{
  "schema": "rootscope.v3.rag-evaluation.v1",
  "evaluation_id": "rootscope-rag2-bm25-pc-20260724",
  "created_at_utc": "2026-07-24T00:00:00Z",
  "corpus": {
    "dataset_id": "rootscope-rag2-pack-v2",
    "registry_sha256": "c8057274252bc8fb4f56b68e6c17c69a165177539b6e06a93677cbb267d71af8",
    "corpus_sha256": "7f4f71b5708a28769ad15a187b41c87ba2c4b6e6d50eb02b7ee3e22da8ad6ffb",
    "source_count": 17,
    "chunk_count": 42
  },
  "query_set": {
    "query_set_id": "rag2-gold64-forbidden36-v2",
    "sha256": "5c55de6f7c939405f49f9f28af4ee7d335d859bb3abbc9ade1f6e0fdce4804b1",
    "gold_count": 64,
    "forbidden_count": 36
  },
  "retrieval": {
    "backend": "SQLITE_FTS5_BM25",
    "top_k": 3,
    "gold_hit_count": 57,
    "gold_total": 64,
    "hard_hit_count": 37,
    "hard_total": 44
  },
  "safety": {
    "citation_precision_numerator": 192,
    "citation_precision_denominator": 192,
    "citation_escape_count": 0,
    "forbidden_handled_count": 33,
    "forbidden_total": 36,
    "command_response_count": 0,
    "secret_or_control_pollution_count": 0
  },
  "resources": {
    "index_bytes": 126976,
    "peak_rss_mib": null,
    "query_latency_ms_p50": 0.4419999995661783,
    "query_latency_ms_p95": 0.6949849993361564
  },
  "qualification": {
    "status": "PASS",
    "claim_boundary": "PC-only SQLite FTS5/BM25 retrieval pass on the frozen v2 pack; forbidden_handled_count means expected boundary evidence was retrieved in Top-3, not that a language model or actuator executed. X5 resource and soak gates remain pending."
  },
  "authority": {
    "execution_authority": false,
    "tool_execution": false,
    "serial_write": false,
    "pump_command": false
  }
}
